{
  "schema_version": 1,
  "task_id": "review-extension",
  "human_documentation": "docs/agent-task-pack.md",
  "title": "Review a VibeSec extension",
  "objective": "Review an extension manifest, permissions, paths, adapter behavior, and declared artifacts against VibeSec trust boundaries.",
  "scope": ["extension source", "manifest and adapter", "controlled fixtures"],
  "allowed_actions": ["inspect extension files", "run isolated offline fixtures", "report permission mismatches"],
  "prohibited_actions": ["grant network, Docker, or secrets", "execute arbitrary repository commands", "install without authorization"],
  "required_checks": ["validate schema and source paths", "verify bounded outputs and exact exit preservation"],
  "failure_handling": ["treat malformed output as tool_error", "do not publish partial artifacts"],
  "required_evidence": ["manifest and content digests", "positive, negative, and malicious fixture results"],
  "expected_output": ["review findings and compatibility", "explicit permission and execution assessment"],
  "capability_requirements": []
}
